{
  "schema_version": "1.0",
  "kind": "chatwoot_event_identity_v1",
  "source": "verified_parse_identity_topology",
  "evidence_id": "cei_9ee62926cfd806b00e5b45c9",
  "ingress_evidence_ref": "cwi_f63c5d3e08893d1c4fde07ca",
  "brand_scope": "calapres",
  "event_identity_key_version": "synthetic-event-identity-v1",
  "canonical_tuple_format": "json-minified-ordered:[schema_version,account_id,inbox_id,event,conversation_id,message_id]",
  "derived_channel": "whatsapp",
  "channel_source": "allowlisted_inbox_mapping",
  "event_identity_fingerprint": "9ee62926cfd806b00e5b45c93bafb9ccbe8d58b09bbb0de574c15b39c5802445",
  "signature_verified_before_parse": true,
  "replay_verified_before_parse": true,
  "verified_parse": true,
  "unsigned_delivery_used": false,
  "payload_brand_used": false,
  "raw_identifiers_in_evidence": false,
  "durable_projection_field": "event_identity_fingerprint",
  "transient_only": true,
  "persistence_allowed": false,
  "wait_payload_allowed": false,
  "data_table_payload_allowed": false,
  "audit_payload_allowed": false,
  "customer_egress_allowed": false
}
